idno,univ,year,date,title,count
pu2531,PolyU,2013,2013-05-22,PolyU and WU Co-organise Knowledge Management Workshop,1
cu2088,CUHK,2015,2015-10-02,CUHK’s Teaching and Research Commended by UGC Quality Assurance Council ICARE Programme Fosters Students’ Whole-person Development ,1
cu1275,CUHK,2012,2012-03-21,CUHK Law Students to Debate the Future of International Law at World’s Most Prestigious Mooting Competition in Washington DC,1
pu0960,PolyU,2008,2008-02-27,PolyU honours outstanding students of the year,1
hu0181,HKU,2006,2006-01-20,HKU's Faculty of Architecture Provides a Solution to Implement the Proposed Mandatory Building Inspection,1
cu0373,CUHK,2008,2008-10-23,SHKP and CUHK Celebrate Fifth Anniversary of The Sun Hung Kai Properties Nobel Laureates Distinguished Lectures,1
hu0364,HKU,2016,2016-03-03,“Hong Kong provides international NGOs a gateway to Asia. Preserving Hong Kong’s advantages for a vibrant civil society is a win-win.”  HKU Centre for Civil Society and Governance Unveils a New Study on International and Cross-boundary NGOs in Hong Kong,1
hu0940,HKU,2003,2003-04-29,HKU to reform its governance and management structures,1
hu0379,HKU,2015,2015-04-14,Six distinguished HKU scholars receive Croucher Innovation and Senior Research Fellowship Awards,1
pu1814,PolyU,2004,2004-04-16,PolyU index indicates that Hong Kong people are optimistic about residential property market,1
hu0142,HKU,2015,2015-05-20,HKU leads the Asia's first genetically modified hematopoietic stem cell transplantation for late juvenile metachromatic leukodystrophy patient (MLD),1
hu0812,HKU,2006,2006-03-15,HKU presented Ian Davies Distinguished Lecture 2006 (in chinese),1
pu2654,PolyU,2013,2013-11-28,PolyU and HKU jointly develop HOPE-20 programme for parents of 2-year-old children,1
hu0669,HKU,2016,2016-05-03,HKU releases findings on anxiety and depression levels of women undertaking test-tube baby treatment and the first self-help “Body-Mind Health Wellness Intervention Program” for women undertaking IVF,1
cu0113,CUHK,2009,2009-11-29,CUHK Scholar Wins ASME Young Engineer Award,1
pu1183,PolyU,2009,2009-06-24,PolyU alumni dedicate scholarship to a devoted teacher,1
pu1933,PolyU,2010,2010-07-16,PolyU and Yan Oi Tong jointly establish Child Development Centre for Giftedness,1
hu0232,HKU,2012,2012-07-11,HKU Announces 2012 Q3 HK Macroeconomic Forecast,1
hu0392,HKU,2008,2008-04-24,HKU Graduates Hotly Sought After -- Reaching Full Employment for Two Consecutive Years With Higher Salary and High Job Satisfaction,1
cu3416,CUHK,2005,2005-03-16,Nobel Laureate Lectures in Chinese University on China and the Global Economy,1
pu1725,PolyU,2010,2010-02-11,PolyU students participate in Lunar New Year Fair to raise fund for charity,1
hu0614,HKU,2011,2011-11-04,HKU holds the Equal Opportunities Festival 2011,1
pu2164,PolyU,2011,2011-10-10,PolyU scientists achieve breakthrough in graphene research,1
pu1562,PolyU,2010,2010-01-22,PolyU study sheds light on lifestyle of middle-class families on mainland,1
pu1716,PolyU,2010,2010-02-09,UNWTO Secretary General Appointed as PolyU Adjunct Professor,1
pu0598,PolyU,2005,2005-10-14,PolyU and Immigration Department jointly introduce award-winning Forged Document Detector,1
cu0341,CUHK,2008,2008-11-29,SHKP and CUHK present Nobel Economist talking on Financing Retirement,1
hu0310,HKU,2008,2008-10-14,2008 HKU Concert Series: Rumpus at the Mei Magistracy with Naamyam Master Au Kuan-cheong,1
pu0363,PolyU,2003,2003-12-22,PolyU releases study on occupational health,1
cu1923,CUHK,2014,2014-11-10,Hong Kong’s First Scientist Awarded Runner-up for the  2014 Eppendorf &amp; Science Prize for Neurobiology CUHK Medical Student Dedicated to Unraveling Mystery of Neuronal Circuits ,1
cu1231,CUHK,2012,2012-01-18,Renowned Scholar in East Asian Studies Professor Ezra F. Vogel Speaks on ‘Deng Xiaoping and Foreign Relations’ at CUHK Today,1
pu1760,PolyU,2005,2005-05-19,PolyU sets the trend in anti-counterfeiting RFID technology,1
hu0600,HKU,2016,2016-05-11,University of Glasgow delegation meets with HKU senior management,1
cu1841,CUHK,2014,2014-07-08,New Director of CUHK Architecture Aspires to Nurture Talents Who Redefine the Profession with Competence and Leadership,1
cu0733,CUHK,2007,2007-05-21,The Chinese University of Hong Kong Sixth Honorary Fellowship Conferment Ceremony,1
hu0685,HKU,2011,2011-06-30,HKU receives nearly 30% of General Research Fund 2011/12,1
cu1116,CUHK,2011,2011-09-05,CUHK Launches I‧CARE Programme Promoting Personal Development through Social and Civic Engagement for Students ,1
hu0617,HKU,2004,2004-05-07,Electrical Engineering Expert to Deliver William Mong Distinguished Lecture,1
pu2307,PolyU,2012,2012-05-24,HKSTPC and PolyU hail success of Hong Kong's innovations following the 40th International Exhibition of Inventions of Geneva ,1
pu1983,PolyU,2010,2010-10-26,PolyU researchers make innovative use of solar energy,1
pu1176,PolyU,2009,2009-06-16,PolyU design scholar shows creativity at work,1
pu1592,PolyU,2006,2006-02-24,PolyU honours outstanding students of the year,1
hu1203,HKU,2011,2011-08-16,HKU/ QMH performed more than 500 da Vinci robotic surgeries,1
hu0445,HKU,2007,2007-04-24,HKU awards honorary degrees to four distinguished persons,1
cu3536,CUHK,2003,2003-03-24,"CUHK Alumni Establish ""WE CARE Foundation"" to Support PWH Workers",1
pu1586,PolyU,2009,2009-08-11,PolyU scholar honoured for dedication to hospitality research and education,1
pu2581,PolyU,2013,2013-07-31,"PolyU graduate snatches the crown of ""Discovering Qing-Fashion Design Competition""",1
pu1758,PolyU,2005,2005-06-29,PolyU BRE Index reflects that public confidence in property market remains positive despite recent increases in interest rates,1
pu0327,PolyU,2004,2004-05-20,Major internship scheme launched with Jockey Club's support,1
hu0734,HKU,2004,2004-11-23,Expert from USA's National Science Foundation to Deliver a Distinguished Lecture at HKU (Press Invitation),1
cu1952,CUHK,2015,2015-01-05,CUHK Bioethics Conference to Explore “Double Whammy” of  Longevity and Biotechnology Revolutions in Hong Kong,1
cu3688,CUHK,2005,2005-04-07,Li Ka Shing Foundation donates HK$60 million to set up institute of health sciences at CUHK,1
cu0807,CUHK,2009,2009-01-01,Young CUHK Information Scientists Win International Acclaim,1
hu0294,HKU,2016,2016-05-09,"Award Presentation Ceremony for Excellence in Teaching, Research and Knowledge Exchange 2015",1
hu0657,HKU,2011,2011-07-27,HKU admits over half of the top students in JUPAS,1
pu2711,PolyU,2014,2014-03-05,Branch Key Lab of Machine Intelligence and Advanced Computing opened at PolyU,1
pu1611,PolyU,2006,2006-11-24,PolyU wins four awards in IENA Exhibition of Germany,1
hu1435,HKU,2008,2008-10-08,HKU Announced 2008 Q4 HK Macroeconomic Forecast,1
cu3563,CUHK,2006,2006-08-30,Otitis media with effusion (OME) can cause hearing loss,1
cu0970,CUHK,2011,2011-02-14,CUHK Faculty of Engineering Hosts Symposium on ‘Information Sciences: Investment and Future Outlook’,1
hu0624,HKU,2015,2015-03-19,Global and Hong Kong oral health challenge:  HKU Faculty of Dentistry calls for Prompt Actions to Fight Oral Diseases! ,1
pu2728,PolyU,2014,2014-05-06,Orthokeratology is an effective way for retarding myopia progression,1
cu2233,CUHK,2016,2016-04-13,Three CUHK Distinguished Scholars Receive Croucher Senior Research Fellowship and Innovation Awards 2016,1
cu3800,CUHK,2004,2004-2005,CUHK Announces its Outstanding,1
cu0971,CUHK,2011,2011-02-15,Siu Lien Ling Wong Visiting Fellows Programme 2010/2011 Chung Chi College The Chinese University of Hong Kong ,1
pu1212,PolyU,2009,2009-10-09,Top Minds to Reflect on Humanities at PolyU Forum,1
cu3137,CUHK,2006,2006-12-07,CUHK Held its 63rd Congregation for Conferment of Degrees          ,1
cu0606,CUHK,2007,2007-12-20,CUHK Study on HKIA’s Third Runway To Enhance Hong Kong’s Aviation Position,1
pu0673,PolyU,2006,2006-09-28,PolyU names lecture theatre after Mrs Samantha Wan,1
cu0382,CUHK,2008,2008-10-19,CUHK Launches Quantitative Finance and Risk Management Science  Double Major Programme for the Age of Turbulence,1
pu2701,PolyU,2014,2014-03-05,Branch Key Lab of Machine Intelligence and Advanced Computing opened at PolyU,1
hu0110,HKU,2013,2013-12-03,Design Democracy Hong Kong www.designdemocracy.hk Website launches (stage one),1
hu0833,HKU,2005,2005-01-27,Prominent International Journalist to Deliver a Lecture at HKU on Transborder Regional Integration (Press Invitation),1
pu2605,PolyU,2013,2013-08-24,Study sheds light on association between adolescents' anxiety and depressive symptoms,1
hu0289,HKU,2012,2012-04-02,HKU announces 2012 Q2 HK Macroeconomic Forecast,1
cu0888,CUHK,2010,2010-11-23,CUHK to Host Hong Kong Geography Day 2010 this Saturday,1
cu0331,CUHK,2008,2008-12-11,CUHK and Cambridge University Jointly Present the First-ever International Conference on Judicial Review in Hong Kong,1
hu0350,HKU,2011,2011-12-30,Opening Ceremony of HKU Shenzhen Institute of Research and Innovation,1
cu0525,CUHK,2007,2007-08-02,Chinese Herbal Medicine Concoction is Efficacious for Atopic Dermatitis Children Patients,1
hu0663,HKU,2012,2012-09-23,HKU International Student Admissions 2012,1
pu2235,PolyU,2012,2012-01-26,Collaborative research sheds light on new cancer stem cell therapies,1
pu1855,PolyU,2010,2010-03-04,PolyU to host public talk series on Corporate Social Responsibility in Action,1
pu6171,PolyU,2015,2015-12-01,PolyU launches the Hong Kong Business Sustainability Index,1
pu2195,PolyU,2011,2011-11-25,PolyU honours outstanding staff members,1
cu3775,CUHK,2005,2005-11-19,Billions of dollars foregone for failure to reach treatment targets in diabetic patients,1
cu2163,CUHK,2016,2016-01-11,CUHK wins the ‘Most Supportive Group Award’ in Standard Chartered Hong Kong Marathon 2016,1
pu0647,PolyU,2006,2006-04-03,PolyU expresses grateful appreciation to donors,1
hu1266,HKU,2015,2015-03-12,"HKU scientists find the H7N9 influenza virus enzootic in poultry Study published in prestigious international scientific journal, Nature",1
hu1401,HKU,2006,2006-07-17,"Press Statement issued on July 17, 2006 in response to Chinese media reports on ""HKU Scholarship for mainland students"" (Chinese Only)",1
hu0353,HKU,2007,2007-10-16,2007 HKU Concert Series: Naamyam Master Au Kwan-cheung,1
pu2522,PolyU,2013,2013-05-15,PolyU researchers develop novel Brain Training Device to reconnect the brain and paralyzed limb after stroke,1
cu0628,CUHK,2008,2008-01-21,CUHK‘s Study on Entrepreneurship Shows  Local Entrepreneurial Activities Tripled,1
cu0076,CUHK,2010,2010-01-18,CUHK’s Study on Entrepreneurship Shows  Dramatic Drop in Hong Kong and Shenzhen Entrepreneurial Activities,1
hu1210,HKU,2016,2016-01-28,The HKU Centre on Behavioral Health releases pilot study findings on Hypnotherapy and Irritable Bowel Syndrome,1
hu0125,HKU,2003,2003-12-18,Nature to Feature the International HapMap Project,1
cu3380,CUHK,2005,2005-12-01,British Consul-General Stephen Bradley Lectures at CUHK,1
hu0829,HKU,2011,2011-08-18,Vice-Premier of the State Council Li Keqiang attends The University of Hong Kong Centenary Ceremony,1
cu1208,CUHK,2011,2011-12-12,CUHK Awards Honorary Doctorates to Four Distinguished Persons,1
cu0600,CUHK,2007,2007-11-01,Professor Joseph Sung appointed as Head of Shaw College of  The Chinese University of Hong Kong,1
hu0162,HKU,2004,2004-01-26,HKU LEADS SEARCH FOR GENETIC BASIS FOR OLD AGE-RELATED SKELETAL DISORDERS,1
hu1407,HKU,2009,2009-12-18,The American Association for the Advancement of Science (AAAS) and The University of Hong Kong (HKU) Announce 2009 Fellows,1
pu1859,PolyU,2010,2010-03-10,Independent panel set up to review management of PolyU's subsidiaries,1
cu1744,CUHK,2014,2014-01-27,CUHK Research Indicates Acupuncture can Improve Cognitive Functions of Elderly  More Elderly Participants to be Recruited for Further Investigation,1
cu3377,CUHK,2004,2004-02-04,NIH Grants Bring CUHK's Research on Chinese Medicine to the International Arena,1
pu1818,PolyU,2003,2003-12-24,PolyU-made space tool to make history,1
hu1270,HKU,2005,2005-09-29,Centenary Lectureship award by Royal Society of Chemistry HKU's Lecturer is the First Chinese Scientist awarded,1
cu1900,CUHK,2014,2014-10-13,CUHK Orientation Day for Undergraduate Admissions,1
pu2109,PolyU,2011,2011-06-03,PolyU students design innovative kitchenware products,1
pu2272,PolyU,2012,2012-03-30,PolyU students excel in designing social innovations,1
hu0660,HKU,2009,2009-07-27,Literati Evening: Qin Music Concert at the Summer Institute in the Arts &amp; Humanities,1
cu2220,CUHK,2016,2016-03-22,CUHK Prof. Hon-Ming Lam Uncovers Structure and Functions of the Rice YchF-type G Protein for The First Time New Findings Help Improve Plants’ Defense Response and Stress Tolerance,1
cu2130,CUHK,2015,2015-11-19,The Chinese University of Hong Kong Holds 78th Congregation for the Conferment of Degrees,1
cu2005,CUHK,2015,2015-04-11,CUHK Jockey Club Initiative Gaia Holds ‘Environment Fair cum MoCC Roadshow 2015’ to Promote Green Living,1
pu2143,PolyU,2011,2011-07-21,PolyU establishes strong foothold in Shenzhen,1
pu1303,PolyU,2004,2004-06-16,PolyU postgraduates stage graduation fashion show,1
cu3362,CUHK,2005,2005-05-19,CUHK Fourth Honorary Fellowship Conferment Ceremony,1
pu1141,PolyU,2009,2009-04-07,Nobel Laureates give weight to inauguration celebration of President Tong,1
cu3459,CUHK,2004,2004-07-06,CUHK Constructs Leading Minimally Invasive Surgical Skills Centre,1
pu1462,PolyU,2004,2004-05-18,PolyU organizes Multimedia Game Workshop for secondary school students in summer,1
hu0133,HKU,2015,2015-12-28,HKU discovers how SARS-CoV evades respiratory innate immunity to establish a systemic infection,1
pu2443,PolyU,2013,2013-01-18,285 dedicated PolyU staff members honoured for long service,1
cu2136,CUHK,2015,2015-11-30,CUHK Alumni Homecoming Day 2015 HK$ 1.22 million raised for Alumni Torch Fund,1
pu2001,PolyU,2010,2010-11-12,PolyU hosts International Conference on Knowledge Management,1
cu3731,CUHK,2006,2006-03-22,CUHK Pioneers New Treatment for VUR in Children,1
hu0990,HKU,2014,2014-07-09,HKU Faculty of Business and Economics Entrance Scholarship for JUPAS Applicants ,1
cu0574,CUHK,2007,2007-11-30,Stigmatization toward people living with HIV/AIDS and other vulnerable groups among the general public in Hong Kong,1
cu1918,CUHK,2014,2014-11-04,CUHK Mechanical and Automation Engineering Celebrates 20 Years of Teaching and Research Excellence  Outstanding Members Earn International Acclaim,1
cu0719,CUHK,2007,2007-04-23,Current CUHK Engineering Graduates Well Sought After by Employers Monthly Salary shoots up to 40K+,1
cu0189,CUHK,2009,2009-07-28,CUHK is the First in the World to Identify a New Relationship between Silent Cerebral Infarct and Deterioration of Normal Tension Glaucoma,1
pu1993,PolyU,2010,2010-11-05,"PolyU DBA/DMgt Educate Global Leaders, not Managers",1
cu3624,CUHK,2006,2006-09-01,The Chinese University Admits Top Students,1
cu1494,CUHK,2013,2013-02-26,Grand Opening of CUHK Yasumoto International Academic Park A New Landmark for International Cultural Exchange ,1
hu1361,HKU,2005,2005-10-27,A New Map of the Human Genome Promises Medical Advances Contribution of the Hong Kong HapMap Group,1
pu2168,PolyU,2011,2011-10-19,PolyU and SZCIQ join force to nurture talents for food safety industry,1
pu1998,PolyU,2010,2010-11-15,PolyU-Peking U joint research breaks new ground in synthesis of anti-cancer agents,1
cu1897,CUHK,2014,2014-10-05,Vice-Chancellor's words for all students,1
pu6014,PolyU,2014,2014-07-29,PolyU Released Report on 2013 Tourist Satisfaction and Tourism Service Quality Indices,1
hu0507,HKU,2004,2004-12-03,Non-Linear Structures Expert to Deliver a William Mong Distinguished Lecture at HKU,1
cu3755,CUHK,2003,2003-11-10,EMBA Forum: Public Speaking is as Simple as Cooking,1
pu2331,PolyU,2012,2012-07-30,PolyU and Tongji University organize joint summer course in Shanghai,1
cu1960,CUHK,2015,2015-01-27,CUHK Advocates Atrial Fibrillation Screening and Drug Education to Reduce Risk of Stroke among Elderly,1
hu0452,HKU,2015,2015-06-09,HKU’s WAY Project --- “Stories of Aberdeen Fishing Folks” Exhibition to showcase the changing lifestyles and culture of fishing folks,1
cu1591,CUHK,2013,2013-07-23,CUHK Launches Hong Kong's First Free Mobile App on Weight Management 'My Wellness Tracker HK',1
pu1891,PolyU,2010,2010-05-20,PolyU advances technology for optimizing digital images,1
pu0995,PolyU,2008,2008-05-27,PolyU launches Knitwear Fashion Show,1
hu0876,HKU,2011,2011-01-14,HKU scientists receive State Science and Technology Awards,1
pu0816,PolyU,2007,2007-04-04,PolyU receives donation from Fenix Group,1
cu2116,CUHK,2015,2015-10-30,CUHK Exhibits Chinese Jades from the Neolithic to the Qing,1
pu1274,PolyU,2009,2009-11-17,Young scientist develops new material for bone repair,1
pu2521,PolyU,2013,2013-05-08,PolyU wins top prizes in Geneva’s Invention Expo,1
pu0718,PolyU,2006,2006-11-27,PolyU alumni join hands in green mission,1
cu2067,CUHK,2015,2015-08-12,CUHK to Hold ‘Distinguished Scholars Seminars – Sign Bilingualism: Scientific Evidence and Educational Applications’ to Address Benefits of Sign Language for Children’s Development,1
cu3586,CUHK,2004,2004-03-29,Leading University Heads Gather to Explore Universities in the 21st Century,1
cu0099,CUHK,2009,2009-12-12,Palliative Care Symposium for Health Care Workers in Chinese Population,1
cu1568,CUHK,2013,2013-05-31,CUHK University Library System Held ‘The Yin-Yang of Future Consortial Collaboration and Competition’ Conference,1
pu1969,PolyU,2010,2010-09-20,PolyU to hold Education Info Day,1
cu0934,CUHK,2010,2010-10-16,Top Scholars Gathered at CUHK to Discuss the Prospect of Humanities in Asia,1
pu1878,PolyU,2010,2010-04-26,PolyU and Pok Oi Hospital join force to upgrade the level of TCM quality assessment,1
cu1035,CUHK,2011,2011-05-29,CUHK Introduces New 4-3-2 English Language Development Model for Four-year Normative Curriculum,1
hu0446,HKU,2015,2015-08-23,‘Bringing Emergency Medicine to Community’:  HKU Medical Students Teaching Domestic Workers Basic Life Support Skills for the Elderly,1
hu0240,HKU,2011,2011-07-13,HKU Chair Professor of Humanities Frank Dikötter awarded the 2011 BBC Samuel Johnson Prize for Non-Fiction,1
pu1756,PolyU,2005,2005-07-11,Construction Industry Institute - Hong Kong and PolyU sign pact  on construction safety project,1
cu0653,CUHK,2008,2008-03-28,CUHK Nethersole School of Nursing and Hong Kong Jockey Club Charities Trust  kick off the 5-year CADENZA training programme,1
pu2424,PolyU,2012,2012-12-25,PolyU-developed AI-based RFID system raises efficiency of apparel industry,1
hu0188,HKU,2005,2005-04-06,Latest Breakthrough in Integrated Heat Pump Technology (Press Invitation),1
pu1209,PolyU,2009,2009-09-30,PolyU asserts leading position in hospitality and tourism research,1
cu1097,CUHK,2011,2011-08-08,CUHK S.H. Ho College Social Service Trip to Uganda Brings Hope to Underprivileged Children and Women ,1
hu0464,HKU,2016,2016-03-16,HKU Reveals Novel Mechanisms by which H5N1 Influenza Virus Causes Acute Lung Injury in Humans and Discovers Novel Therapeutic Strategies,1
cu1997,CUHK,2015,2015-03-29,CUHK Launches Territory’s First Cloud-based eLearning Platform,1
cu3533,CUHK,2005,2005-09-02,Renowned Economist Robert Barro Lectures at Chinese University,1
cu2217,CUHK,2016,2016-03-21,Large-Scale Study Shows the Effectiveness of Parent Coaching Program in Improving Children’s Learning Skills,1
pu2422,PolyU,2012,2012-12-17,PolyU Professor-designed Accessible Aircraft Lavatory won international awards,1
cu2297,CUHK,2016,2016-07-06,CUHK Launches Chinese Art &amp; Culture Month for 400 International Summer School Students ,1
pu0982,PolyU,2008,2008-04-29,PolyU study sets off warning to HK's retail services,1
pu1051,PolyU,2008,2008-10-30,PolyU co-hosts international value management conference,1
cu1601,CUHK,2013,2013-08-14,CUHK ISEIS Conducts the UN Regional Training Workshop on Applications of Space Technology for Disaster Risk Management and Sustainable Development,1
pu2206,PolyU,2011,2011-10-20,PolyU releases Report on 2011 Tourist Satisfaction Index,1
cu1093,CUHK,2011,2011-08-04,CUHK Hong Kong Quality of Life Index:  Quality of Life in Hong Kong Stabilized  ,1
hu0292,HKU,2004,2004-04-21,HKU Vice-Chancellor Elected Member of the National Academy of Sciences in United States of America,1
cu1882,CUHK,2014,2014-09-19,"CUHK Hosts Symposium on Youth Work and Youth Support in a Changing Society: Challenges, Opportunities and Innovations",1
pu6079,PolyU,2015,2015-01-23,PolyU National Agricultural Holdings Invitational Golf Tournament successfully raises funds for student development,1
hu0158,HKU,2016,2016-05-07,First community-led “Sports for ALL” sports day kicks off Aiming for an inclusive society for children of all abilities ,1
pu0590,PolyU,2005,2005-09-29,PolyU showcases applied research strength at Innovation Expo 05,1
hu0602,HKU,2015,2015-08-24,The international collaboration of HKU team finds that selecting genetically supported drug-targets can double the success rate in drug clinical development,1
pu0351,PolyU,2004,2004-02-03,“Faces &amp; Places at PolyU?Photo Competition exhibition opens,1
hu0340,HKU,2014,2014-06-06,University Museum and Art Gallery Exhibition “The Tank Man and the Changing Art and Craft of Photojournalism”,1
cu0522,CUHK,2007,2007-08-13,Multi-centre Study by CUHK Proves a New Treatment Option  for Asian Chronic Hepatitis C Patients,1
hu0757,HKU,2010,2010-06-29,HKU Faculty of Education 2010 Knowledge Exchange Awards for Staff and Students,1
hu0816,HKU,2006,2006-11-09,HKU Research to Review Building Construction Safety Measures,1
pu1227,PolyU,2009,2009-10-25,"PolyU receives $5M donation to set up ""Commercial Radio 50th Anniversary Scholarship""",1
hu0588,HKU,2014,2014-09-23,Exhibition “A Universe Within:First time display in HK Suo Zhenhai's Inside-painted Snuff Bottles from the Hong Yuan Collection”,1
pu2193,PolyU,2011,2011-11-19,Community Weather Information Network launches Community Weather Observing Scheme,1
cu1064,CUHK,2011,2011-07-07,CUHK Professor Lin Hui Appointed as Member of Scientific Committee of UNESCO WHIST,1
hu0884,HKU,2016,2016-01-26,Resolution by the University Council at the meeting on January 26,1
hu1044,HKU,2011,2011-04-28,HKU study provides first evidence that rise in tobacco tax curbs adolescent smoking,1
cu2194,CUHK,2016,2016-02-29,Survey Findings on the HKSAR Government’s Popularity in February 2016 Released by Hong Kong Institute of Asia-Pacific Studies at CUHK,1
pu1661,PolyU,2007,2007-10-26,PolyU students excel in International Competition,1
cu0158,CUHK,2009,2009-09-29,Exhibition Shows CUHK’s Star Researchers Through the Lens of Ducky Tse,1
pu0610,PolyU,2005,2005-11-14,Greening Hong Kong by PolyU Alumni,1
pu1289,PolyU,2005,2005-01-10,Nature featured new findings of PolyU's manikin expert,1
pu1438,PolyU,2010,2010-01-14,PolyU Hosts Seminar for Air Freight Forwarding Industry,1
pu0980,PolyU,2008,2008-04-28,SPEED’s Business Innovation Awards Presentation Ceremony,1
pu6212,PolyU,2016,2016-04-18,Master's Degree in International Wine Management  Grooms Future Leaders of Global Wine Industry,1
cu1635,CUHK,2013,2013-09-26,CUHK Hong Kong Quality of Life Index:  Quality of Life in Hong Kong Rebounded Slightly,1
hu0457,HKU,2004,2004-10-31,Press Conference on Transport Services for Wheelchair Users in Hong Kong (Press Invitation),1
pu2114,PolyU,2011,2011-06-17,Global Student Challenge 2011 comes to fruitful close,1
pu1563,PolyU,2010,2010-01-13,PolyU Faculty of Business Achieves Triple Accreditation,1
hu1411,HKU,2015,2015-09-01,Convocation of The University of Hong Kong (HKU Convocation) Extraordinary General Meeting (updated to 7:30pm),1
pu1491,PolyU,2003,2003-02-26,PolyU honours top students of the year,1
cu1933,CUHK,2014,2014-11-27,Survey Findings on the HKSAR Government’s Popularity in November 2014 Released by Hong Kong Institute of Asia-Pacific Studies at CUHK,1
cu3318,CUHK,2006,2006-12-18,Michael Lyu Awarded Fellowship of the American Association for the Advancement of Science (AAAS)          ,1
pu6009,PolyU,2014,2014-06-27,PolyU joins hands with HKATH to host the 1st International Conference on Horticultural Therapy and Therapeutic Landscaping,1
cu0555,CUHK,2007,2007-10-24,CUHK is the World’s Pioneer in the Use of Computer Navigation for Bone Tumor Surgery ,1
cu0915,CUHK,2010,2010-12-23,2010 CAE Academicians Visit Programme cum Lecture Series Successfully Launched,1
cu0241,CUHK,2009,2009-04-29,CUHK Appoints CEO of ASTRI Dr. Cheung Nim-kwan as Honorary Professor of the Faculty of Engineering,1
pu2542,PolyU,2013,2013-06-13,PolyU scholar wins two international awards,1
pu2663,PolyU,2013,2013-12-11,PolyU School of Nursing hosts Hong Kong’s First Innovation Day and Innovation Awards Competition,1
hu0913,HKU,2009,2009-04-29,HKU to Kick Start Project WATERMAN – A Water Quality Forecast and Management System for Hong Kong,1
cu3479,CUHK,2003,2003-06-10,CUHK Survey Shows Misperceptions on SARS Risk and Calls for Rationality in Facing the Disease,1
cu3439,CUHK,2005,2005-04-07,Mood Disorders in Post Stroke Patients in Hong Kong,1
cu1318,CUHK,2012,2012-05-24,CUHK and French Researchers Pioneer the Use of Non-Invasive Imaging Technology – New XL Probe to Assess Liver Disease in Obese Patients  ,1
pu2263,PolyU,2012,2012-03-06,PolyU opens Speech Therapy Unit and signs MoU with Tung Wah Group of Hospitals,1
pu6123,PolyU,2015,2015-07-06,PolyU Released Report on 2014 Tourist Satisfaction and Tourism Service Quality Indices,1
pu0861,PolyU,2007,2007-06-12,PolyU pays tribute to 14 University Fellows,1
