idno,univ,year,date,title,count
hu1246,HKU,2016,2016-05-31,HKU appoints Vice-President (Academic Staffing and Resources),1
cu2159,CUHK,2016,2016-01-04,Survey Findings on the HKSAR Government’s Popularity in December 2015 Released by Hong Kong Institute of Asia-Pacific Studies at CUHK,1
hu0861,HKU,2005,2005-09-30,HK's Best Take Global Education Programme,1
cu1752,CUHK,2014,2014-02-17,"CUHK Shaw College Sir Run Run Shaw Distinguished Visiting Scholar Lecture 2013-14 Prof. Daisy HUNG, Institute of Cognitive Neuroscience, Taiwan Central University to Speak on 'Brain and Life' Now Open for Public Registration",1
pu2690,PolyU,2014,2014-02-16,"3,900-strong PolyU team runs for Hong Kong Marathon 2014",1
pu1040,PolyU,2008,2008-10-09,PolyU President welcomes 158 scholarship recipients,1
cu3506,CUHK,2006,2006-02-17,CUHK Shares First Hand Experience Using Cardiac Contractility Modulation in Asia,1
cu2002,CUHK,2015,2015-04-02,CUHK Jockey Club Initiative Gaia to Hold ‘Environment Fair cum MoCC Roadshow 2015’ to Promote Green Living All are Welcome,1
hu0533,HKU,2015,2015-09-21,APV and the University of Hong Kong’s Journalism and Media Studies Centre names Lukas Messmer as first recipient of  the Mick Deane Scholarship for Video Journalism,1
cu1194,CUHK,2011,2011-11-29,CUHK Faculty of Engineering Achieved Breakthrough in Image Motion Deblurring Technology ,1
pu1302,PolyU,2004,2004-06-29,PolyU logistics student gets MSC scholarship,1
hu1384,HKU,2014,2014-07-03,Exhibition “Refuse the Shadows of the Past:  Five Years of Austrian Art Made in China” opens at HKU ,1
pu1697,PolyU,2006,2006-06-26,PolyU BRE index forecasts a marginal fall in property prices as interest rate increases,1
pu1473,PolyU,2003,2003-11-18,PolyU's facility management programme wins international accreditation,1
cu1395,CUHK,2012,2012-09-21,Inauguration of Lee Quo Wei CUHK Golden Jubilee  Scholarship Endowment Fund ,1
pu1811,PolyU,2004,2004-06-21,ITF-funded nano-technology project bears fruit,1
hu0163,HKU,2011,2011-12-18,"Presidents Summit: “East Meets West: Synergy, Competition or Collaboration”",1
cu2216,CUHK,2016,2016-03-19,CUHK Social Work and Psychiatry Research Reveals Efficacy of Multiple Family Group Therapy for Children with ADHD and Their Families ,1
hu0179,HKU,2011,2011-04-21,Statement by HKU on the theft of a USB stick containing student data,1
hu0048,HKU,2008,2008-12-08,A Public Lecture - Doubleness: Photography of Chien-Chi Chang,1
hu0111,HKU,2011,2011-10-16,HKU students link up via internet with Ewha Womans University students for new Korean Studies courses,1
pu1095,PolyU,2009,2009-01-14,UNWTO Secretary General appointed as PolyU honorary professor,1
hu0605,HKU,2003,2003-12-11,Professor of Nanotechnology to deliver William Mong Distinguished Lecture in HKU,1
pu2566,PolyU,2013,2013-07-11,PolyU organizes inaugural Forum on MOOCs in Hong Kong,1
cu0088,CUHK,2010,2010-01-07,Opinion Poll on 2012 Constitutional Reforms,1
pu2217,PolyU,2011,2011-12-28,8th International Shibori Symposium kicks off on PolyU campus,1
pu2073,PolyU,2011,2011-03-27,PolyU to cover transportation design in its Master of Design programme,1
pu1098,PolyU,2009,2009-01-20,PolyU and University of Arts London organize international fashion exhibition,1
cu1983,CUHK,2015,2015-03-04,Survey Findings on Views about the Individual Visit Scheme  Released by Hong Kong Institute of Asia-Pacific Studies at CUHK,1
pu0380,PolyU,2003,2003-11-06,PolyU mathematics professor scores world honour,1
cu3583,CUHK,2005,2005-07-09,CUHK Hosts First Joint Conference of Chinese Poison Centers,1
pu1456,PolyU,2009,2009-09-21,PolyU to hold Education Info Day,1
cu3223,CUHK,2006,2006-05-08,CUHK Commends Young Researchers,1
cu3259,CUHK,2005,2005-08-11,Lee Shau Kee Foundation Donates HK$50 Million to the Chinese University,1
pu0389,PolyU,2003,2003-10-12,PolyU partners with industry to study healthy buildings,1
pu0603,PolyU,2005,2005-10-30,PolyU to confer four honorary doctorates at Congregation,1
hu1305,HKU,2015,2015-06-02,Launch Ceremony and Press Conference for  “JC A-Connect: Jockey Club Autism Support Network”,1
hu0135,HKU,2014,2014-03-19,"HKU, University of Toronto and Queen Elizabeth Hospital joint study on a trans-oral NP brush biopsy for early detection of nasopharyngeal cancer",1
hu0189,HKU,2009,2009-10-07,HKU Announces 2009 Q4 HK Macroeconomic Forecast,1
pu1554,PolyU,2006,2006-07-10,PolyU develops intelligent dressing mirror and fitting room,1
pu2221,PolyU,2012,2012-01-08,PolyU names Intensive Care Laboratory after the late Ms Dorothy Wong,1
cu1654,CUHK,2013,2013-10-15,CUHK ISEIS Postgraduate Students Highly Praised in UN Internship Programme,1
pu1223,PolyU,2009,2009-10-21,PolyU seeks to achieve further internationalization,1
hu1406,HKU,2016,2016-08-08,HKU JUPAS main round offer results,1
pu1692,PolyU,2006,2006-09-29,PolyU releases latest Customer Perceived Value in Hong Kong's retail sector,1
pu0424,PolyU,2003,2003-02-17,Winners of Outstanding PolyU Alumni Award announced,1
hu0853,HKU,2013,2013-11-12,HKU holds Equal Opportunities Festival 2013  Forum on “What it takes to be different”,1
cu0589,CUHK,2007,2007-11-14,United College Distinguished Visiting Scholar Professor Ya-ping Zhang ,1
pu1930,PolyU,2010,2010-07-13,PolyU annual report wins silver award in international competition,1
pu0832,PolyU,2007,2007-04-30,World-class experts to speak at the international forum on fashion and textiles,1
pu0575,PolyU,2005,2005-08-17,PolyU establishes new Department of Health Technology and Informatics,1
hu1141,HKU,2009,2009-05-12,HKU and King's College London (King's) - Sign First-of-its-kind Joint PhD Programme Framework and Dual Degree Programme in Law,1
cu3118,CUHK,2005,2005-06-21,CUHK Graduates Develop World's First Photo Editing Software for Mobile Phones,1
cu3802,CUHK,2005,2005-05-13,CUHK Institute of Chinese Medicine Awarded NIH Grant For Advanced Research on Anti-Cancer Herbs,1
hu0499,HKU,2010,2010-08-27,HKU launches the largest processing power Grid Computing resources,1
pu0890,PolyU,2007,2007-09-12,PolyU SD Design Month 2007 kicks off,1
pu1058,PolyU,2008,2008-11-11,PolyU and SichuanU review Post-Earthquake Relief Work at Forum in Memorial of Wenchuan Earthquake,1
hu0262,HKU,2015,2015-06-03,HKU Phase 1 Clinical Trials Centre moves forward to its 1st Anniversary Focus on phase 1 and early phase clinical trials to bring novel treatments,1
cu0757,CUHK,2007,2007-07-24,CUHK and IBM Cooperate to Boost Youths’ interests in Engineering  Students spark enthusiasm in Engineers Week,1
cu0392,CUHK,2008,2008-10-10,SHKP and CUHK Present Nobel Laureate Lecture  Eminent Professor in Physiology or Medicine Speaks on the Origins of ES Cells,1
cu1096,CUHK,2011,2011-07-04,Naming Ceremony of Run Run Shaw Science Building at CUHK Held Today,1
cu2012,CUHK,2015,2015-04-22,CUHK Jockey Club Initiative Gaia Forum on ‘Biodiversity Conservation’ Open for Public Registration,1
pu2150,PolyU,2011,2011-09-10,PolyU and Warwick jointly hold 19th Congregation for Integrated Engineering Business Management Programme,1
pu6133,PolyU,2015,2015-08-21,"""Lead"" in water samples collected from hot water dispensers at Homantin Halls of Residence higher than World Health Organisation level",1
pu1465,PolyU,2004,2004-04-20,PolyU activities turn secondary students’ holidays into worthy learning experience,1
cu1777,CUHK,2014,2014-03-20,Inauguration of CASS-CUHK Chinese Archaeology Joint Research Base,1
hu0212,HKU,2013,2013-07-25,HKU’s finding on avian influenza A (H7N9) virus well adapted to infect human respiratory tract reveals why numerous human infected cases in a short period of time,1
pu1840,PolyU,2003,2003-02-26,PolyU honours top students of the year,1
cu1553,CUHK,2013,2013-05-13,The Chinese University of Hong Kong  Twelfth Honorary Fellowship Conferment Ceremony  ,1
cu3092,CUHK,2006,2006-12-14,CUHK continues to rank top as 4 more professors named IEEE Fellow          ,1
hu1243,HKU,2003,2003-04-23,HKU And Chinese CDC Jointly Organize A Symposium On Atypical Pneumonia Medical Experts Discuss Collaborations Of Controlling The Disease (Invitation),1
hu1405,HKU,2015,2015-06-01,"Conserving Global Marine Biodiversity in a Changing World:  HKU hosts ‘International Conference on Biodiversity, Ecology and Conservation of Marine Ecosystems (BECoME 2015)’",1
pu2031,PolyU,2011,2011-01-05,PolyU hosts Journal of Contemporary Accounting and Economics Symposium,1
pu2550,PolyU,2013,2013-06-24,International Research Centre for Communication in Healthcare officially opens,1
pu0999,PolyU,2008,2008-05-30,PolyU and CUHK create The Hong Kong Jockey Club Sports Medicine and Health Sciences Centre for elite athletes and the general public,1
pu1232,PolyU,2009,2009-11-04,PolyU and the Hong Kong Jockey Club Sports Medicine and Health Sciences Centre Render Full Support for 2009 East Asian Games,1
cu1172,CUHK,2011,2011-11-08,CUHK Risk Management Science Students Win the 2011 DBS-SMU Quantitative Finance Challenge,1
cu3482,CUHK,2004,2004-11-16,Structured Care Saves Lives for Diabetic Patients,1
cu1567,CUHK,2013,2013-05-28,CUHK Releases the MTR-CUHK Youth Quality of Life Index Today,1
cu0858,CUHK,2010,2010-09-11,CUHK Shares the Fruits of Community Fall Prevention Program  and Research Findings after a Decade of Dedication  in Reducing Fall and Fracture Among the Elderly,1
hu1000,HKU,2015,2015-11-12,HKU &amp; PolyU announce the establishment of Respiratory Virus Research Foundation ,1
pu0634,PolyU,2006,2006-02-07,CUHK and PolyU experts recreate drawings of St John's Cathedral,1
hu0487,HKU,2004,2004-03-23,Universitas 21 International Research Collaboration Initiative Meeting,1
cu1772,CUHK,2014,2014-03-17,"CUHK and Utrecht co-organize Symposium on the Neurogenetics of Language and Cognition  to celebrate the launch of CUHK-UU Joint Centre for Language, Mind and Brain",1
pu1789,PolyU,2004,2004-10-07,PolyU inventors strike gold in China International Invention Expo,1
cu0824,CUHK,2009,2009-01-06,CUHK Discovers Reverse of Dying-process in Cancer Cells,1
pu1581,PolyU,2009,2009-05-07,PolyU's Mega-Structure Diagnostic and Prognostic System gains international recognition,1
pu1142,PolyU,2009,2009-04-09,"Open Dialogue with Nobel Laureate, Professor John Nash  Thousand Students meet the Beautiful Mind",1
cu3091,CUHK,2004,2004-06-11,CUHK Accounting Graduate is World Top Winner in ACCA Examination,1
cu3495,CUHK,2005,2005-08-16,Drug-Associated Heat Stroke,1
cu0255,CUHK,2009,2009-04-14,World-renowned Computer Scientist Professor Benjamin Wah Appointed CUHK Provost,1
hu1177,HKU,2005,2005-10-05,Economic Growth will Slow Down According to HKU APEC Study Center,1
cu1235,CUHK,2012,2012-01-26,Research Centre for Chinese Ancient Texts in Hong Kong Renamed 'D. C. Lau Research Centre for Chinese Ancient Texts',1
pu6181,PolyU,2016,2016-01-13,PolyU welcomes the initiatives related to education and innovation in Policy Address,1
cu3347,CUHK,2006,2006-09-22,Commissioner of Ministry of Foreign Affairs Lectures at Chinese University,1
hu0797,HKU,2006,2006-06-07,Books and Their Stories: Gems from the University of Hong Kong Libraries Collection 9 June to 30 July 2006,1
cu3780,CUHK,2005,2005-04-14,Recent Achievements of the CUHK Faculty of Business Administration in Asia,1
hu1394,HKU,2011,2011-09-07,Faculty Knowledge Exchange Awards of The University of Hong Kong,1
pu1898,PolyU,2010,2010-04-28,Stanford scholar speaks on language changes at PolyU,1
cu0222,CUHK,2009,2009-05-26,CUHK Scholar as the First Asian to Win Best Paper Award at International Flagship Computer Vision Conference,1
cu1920,CUHK,2014,2014-11-03,CUHK Approves First Student Exchange Programme on Integrative Medicine with U of Toronto Promoting Development of Integrative Medicine in Hong Kong and Canada,1
cu1217,CUHK,2011,2011-12-20,Two CUHK Staff Received Honours University Librarian Awarded Honorary Fellowship of HK Library Association History Professor Honoured with French Knighthood ,1
hu0930,HKU,2012,2012-05-21,"FAMILY: A Jockey Club Initiative for a Harmonious Society Cohort Study Result Announcement Study on Family Support An Effective Way to Enhance Family Support – ""Happy Family Kitchen"" Project",1
pu2526,PolyU,2013,2013-05-20,PolyU and Sichuan U jointly set up China's first Institute for Disaster Management and Reconstruction,1
cu1880,CUHK,2014,2014-09-17,Prof. Wolfgang Behr of Zurich University to Share Insights on Chinese Scribal Oddities at CUHK,1
pu2533,PolyU,2013,2013-06-03,PolyU scientists help identify genes causing myopia,1
cu2090,CUHK,2015,2015-10-05,CUHK Psychology Department Holds Seminar on Early Literacy Development Open for Public Registration,1
pu6026,PolyU,2014,2014-09-04,PolyU invites professional chefs and grassroot families to prepare a feast using unwanted fresh food collected from local wet markets,1
pu1293,PolyU,2005,2005-01-20,PolyU introduces the world's first soft mannequin and Asia's first BA in Intimate Apparel programme,1
cu1969,CUHK,2015,2015-02-07,CUHK and Caritas Join Hands to Promote Mental Health through Community-based Prevention Programme,1
pu1389,PolyU,2006,2006-04-20,PolyU's Research Centre for Professional Communication in English established,1
pu1714,PolyU,2006,2006-03-21,"Interest rates hikes discounted, property prices expected to stabilize",1
cu2257,CUHK,2016,2016-05-09,CUHK to Hold Programme Exploration Days for JUPAS Applicants,1
cu0815,CUHK,2009,2009-01-11,23rd Founder’s Day Celebration Ceremony of CUHK Shaw College,1
cu0313,CUHK,2009,2009-01-15,Traditional Chinese Medicine Effectively Relieves Irritable Bowel Syndrome,1
pu0400,PolyU,2003,2003-07-15,Trees on PolyU campus named after alumni and sponsors,1
hu1123,HKU,2007,2007-07-04,HKU Announced 2007 Q3 HK Macroeconomic Forecast,1
pu2264,PolyU,2012,2012-03-08,PolyU honours outstanding students of the year,1
hu0524,HKU,2011,2011-08-16,Live webcast of the University of Hong Kong Centenary Ceremony,1
pu0433,PolyU,2003,2003-01-12,700 PolyU members join Walks for Millions,1
cu2118,CUHK,2015,2015-10-30,CUHK Jockey Club Initiative Gaia Holds the ‘Design for Sustainability (D4S)’ Forum,1
pu1271,PolyU,2010,2010-01-04,PolyU plays host to International Conference on Ethics and Policy of Biometrics,1
cu3450,CUHK,2005,2005-01-20,Current U.S. treatment guidelines for coronary heart patients need revision,1
cu2283,CUHK,2016,2016-06-08,Heartfelt support to our student Ma Cheuk-long,1
cu3612,CUHK,2003,2003-08-05,Survey Results on Peer Sexual Harassment in Local Tertiary Institutions,1
cu0415,CUHK,2008,2008-04-02,State Key Laboratory of Agrobiotechnology (CUHK)  Set Up at CUHK with State Approval ,1
cu1453,CUHK,2012,2012-12-11,CUHK Professor Rossa Chiu Awarded Chinese Young Women in Science Fellowship Latest Research Breakthrough – Blood DNA Sequencing to Scan for Cancers  ,1
cu3528,CUHK,2005,2005-06-09,Impacts of 26 December Tsunami to Hong Kong Citizens' Mental Health,1
hu0851,HKU,2016,2016-04-21,"HKU main website hku.hk wins top prize and named the ""Most Liked .hk Website"" in Best .hk Website Awards ",1
pu0627,PolyU,2005,2005-12-22,PolyU to host International Convention and Expo Summit,1
cu1003,CUHK,2011,2011-03-30,CUHK ISEIS Offers Advanced Workshop and Certificate Course on  Disaster Early Warning and Emergency Management Now Open for Online Registration ,1
cu2073,CUHK,2015,2015-09-03,Vibrant Orientation Activities for New Students in CUHK,1
cu3334,CUHK,2004,2004-09-22,CUHK No. 1 Again in 2004 MBA Ranking,1
pu1461,PolyU,2004,2004-05-23,PolyU to hold Consultation Day for JUPAS applicants,1
pu0347,PolyU,2004,2004-02-17,Fulbright China Research Forum a draw for experts in China studies,1
hu1271,HKU,2010,2010-06-03,HSBC/McKinsey Business Case Competition 2010 Final Results Announcement,1
cu3303,CUHK,2004,2004-11-30,CUHK's BA Faculty Proposes Ways to Raise The Cost Competitiveness of Hong Kong Businesses,1
hu0814,HKU,2011,2011-10-20,“Health Care Hero” – HKU Vice-Chancellor Professor Lap-Chee Tsui named to 2012 Canadian Medical Hall of Fame,1
cu1991,CUHK,2015,2015-03-18,CUHK Celebrates 100th Birthday of Prof. Jao Tsung-I,1
cu0549,CUHK,2007,2007-09-11,The Shaw Laureate in Life Science and Medicine 2007 to Lecture at CUHK on Seven Transmembrane Receptors,1
hu0508,HKU,2006,2006-05-21,Two Chair Professors join HKU Faculty of Arts,1
cu2127,CUHK,2015,2015-11-17,The Third CUHK-UNESCAP Internship Programme Concludes with Success,1
cu0390,CUHK,2008,2008-10-12,CUHK Study on Renewable Energy Wins ASME Best Paper Award,1
hu0547,HKU,2013,2013-05-15,Scientists Reveal How Dinosaurs Became Able to Shake Their Tail Feathers,1
cu1845,CUHK,2014,2014-07-17,CUHK Survey: About 90% Hepatitis C Patients Unaware of Infection and Majority Refuses Treatment,1
cu0405,CUHK,2008,2008-04-21,Vice-Chairman of the Standing Committee of The 10th NPC Professor Cheng Siwei Lectured at CUHK Today,1
hu0478,HKU,2012,2012-10-05,HKU MBA Programme Ranked No. 1 in Asia By The Economist ,1
cu1913,CUHK,2014,2014-10-29,MTR-CUHK Youth Quality of Life Champions Competition 2015 Now Open for Applications ,1
pu0874,PolyU,2007,2007-07-11,PolyU and Lane Crawford join hands to showcase Hong Kong’s designers of tomorrow,1
hu0546,HKU,2014,2014-11-14,“Conforming to Vicinity – A Cross-Strait Four-Region Artistic Exchange Project 2014” opens at the University Museum and Art Gallery ,1
cu1829,CUHK,2014,2014-06-10,CUHK University Library Won HKIA Annual Awards 2013:  Special Architectural Award - Architectural Interior ,1
pu0951,PolyU,2008,2008-01-15,PolyU and American Accounting Association co-host International Conference on Accounting and Economics,1
pu1909,PolyU,2010,2010-06-15,PolyU explores collaboration with China Academy of Space Technology,1
hu1234,HKU,2003,2003-05-15,Positive Teaching and Learning Quality Process Review Report on HKU,1
pu0766,PolyU,2007,2007-01-26,PolyU joins Microsoft Dynamics Academic Alliance,1
hu0925,HKU,2011,2011-09-30,University Artists Scheme: Filmmaker Mr Peter Ho Sun Chan Discusses his Latest Film WU XIA with Cultural Columnist Dr Ma Ka Fai,1
cu0556,CUHK,2007,2007-10-23,CUHK to Continue Seeking Feedback on Campus Master Plan,1
cu3430,CUHK,2006,2006-10-10,Nethersole Nursing Practice Research Unit Opened Today          ,1
cu0592,CUHK,2007,2007-11-12,Former Governor General of Canada The Right Honourable Adrienne Clarkson Lectured at Chinese University ,1
pu2134,PolyU,2011,2011-08-10,PolyU wins Men's Team in All China Universities Badminton Championship,1
cu1051,CUHK,2011,2011-06-23,CUHK Hosts Reporting and Briefing Session of the Territory’s First Food Composition Database,1
pu2488,PolyU,2013,2013-03-28,PolyU sets up Joint Lab in collaboration with China Academy of Space Technology,1
hu0504,HKU,2004,2004-09-08,WHO suicide prevention head attends HK's World Suicide Prevention Day program (Press Invitation),1
pu6179,PolyU,2016,2016-01-06,PolyU organizes the International Conference on Service Leadership Education in Service Economies,1
cu0847,CUHK,2010,2010-08-23,Dr. the Honourable Andrew Li Appointed CUHK Honorary Professor of Law,1
pu1815,PolyU,2004,2004-02-23,PolyU honours outstanding students of the year,1
pu1475,PolyU,2003,2003-10-23,PolyU pays tribute to six distinguished Chinese scholars,1
cu0482,CUHK,2008,2008-08-27,Swiss Students Experience Life in Hong Kong on CUHK  Cultural Exchange Programme,1
pu1457,PolyU,2009,2009-11-09,PolyU to hold Education Exhibition for JUPAS Applicants,1
hu1046,HKU,2015,2015-04-25,HKU hosts the “I’m Little but Not Less: Have I a place in your school?” Symposium,1
hu0890,HKU,2013,2013-05-24,"HKU and international research team find human-isolated avian influenza A (H7N9) virus can transmit via close contact and air-borne exposure while it can also infect pigs, Research published in prestigious international scientific journal, Science",1
cu0520,CUHK,2007,2007-08-17,"CUHK launches Department of Otorhinolaryngology, Head and Neck Surgery Independent department will further strengthen training and research and expand clinical services ",1
cu0001,CUHK,2010,2010-04-06,CUHK Department of Translation and the University of Oxford jointly organize an international conference on ‘Cultural Interactions: Chinese Literature in English Translation’,1
pu0657,PolyU,2006,2006-06-14,Secondary students get a taste of university life at PolyU,1
pu1729,PolyU,2006,2006-08-21,PolyU excels in civil engineering research,1
cu1730,CUHK,2014,2014-01-07,In memory of Dr. the Honourable Run Run Shaw,1
cu1910,CUHK,2014,2014-10-27,Survey Findings on the HKSAR Government’s Popularity in October 2014 Released by Hong Kong Institute of Asia-Pacific Studies at CUHK,1
hu1380,HKU,2008,2008-10-11,500 Academics and Professionals Turn a New Page for Successful Ageing at the CADENZA Symposium 2008,1
pu0626,PolyU,2005,2005-12-19,"PolyU Scientist wins Science and Technology Progress Award in Surveying and Mapping, China",1
pu1683,PolyU,2006,2006-11-14,PolyU textile scientist honoured by Sang Ma Trust Fund,1
cu2097,CUHK,2015,2015-10-16,CUHK Art Museum Exhibits Precious Ancient Rubbings Eight Pieces Being Considered for the National Catalogue of Precious Ancient Books,1
cu0503,CUHK,2008,2008-07-18,CUHK Introduces Innovative Preschool Curriculum to Enhance Children’s Logical Thinking in Mathematics,1
cu0407,CUHK,2008,2008-04-17,Children with Obstructive Sleep Apnea are at Risk of Hypertension,1
pu1300,PolyU,2004,2004-07-21,PolyU optometrists reveal study of children's sunglasses,1
pu2209,PolyU,2011,2011-11-11,Study on woodpeckers unlocks the key to avoid head injury,1
pu6149,PolyU,2015,2015-09-30,"PolyU Micro Fund tops up the entrepreneurship seed fund to HK$120,000",1
cu1573,CUHK,2013,2013-06-05,CUHK Medical Student Unraveled Mystery of Neuronal Circuits Development Findings recently published in prestigious scientific journal Nature,1
cu1736,CUHK,2014,2014-01-16,CUHK Professor Dennis Lo Awarded King Faisal International Prize for Medicine,1
pu2178,PolyU,2011,2011-11-02,PolyU to hold Admission Talks for HKDSE students,1
hu1432,HKU,2010,2010-09-17,HKU MBA Programme Ranked No. 1 in Asia by Economist Intelligence Unit,1
hu1111,HKU,2008,2008-11-23,CUHK Won the Vice-Chancellor's Cup Soccer Match 2008,1
cu0185,CUHK,2009,2009-08-07,CUHK Ministry of Education - Microsoft Key Laboratory Sets New Milestones for Human-Centric Computing and Interface Technologies,1
cu0551,CUHK,2007,2007-09-07,Li Ka Shing Foundation continuous support to CUHK Official opening of LKS Institute of Health Sciences and establishment of second LKS Professorship,1
cu1503,CUHK,2013,2013-03-12,Celebrating 50 Years of Excellence:  CUHK Hosts APAIE Conference and Exhibition 2013 'An Ascendant Asia-Pacific: International Higher Education in the 21st Century' Largest International Education Conference Ever Held in the Region ,1
hu0682,HKU,2013,2013-11-26,HKU holds the 189th Congregation,1
hu1162,HKU,2007,2007-03-09,HKU Press Statement on Outside Clinical Practice,1
hu0619,HKU,2009,2009-06-18,Review Confirms the Effectiveness of HKU’s Governance and Management Reforms,1
cu1011,CUHK,2011,2011-04-18,CUHK Symposium on Geoinformation and Earth Sciences: Human Habitat Showcased Research Achievements Towards Better Living Environment,1
cu1597,CUHK,2013,2013-08-01,CUHK Appoints University Bursar,1
hu0342,HKU,2005,2005-07-06,HKU to Outline Its Vision for Next 10 year in a Press Briefing Held Tomorrow (Press Invitation),1
pu1369,PolyU,2005,2005-01-28,HKCC graduates enjoy articulation onto OUHK's degree programmes,1
hu0991,HKU,2016,2016-03-08,Nobel Laureate Distinguished Lecture by Professor Eric S. Maskin “Financial Crises: Why They Occur and What to Do about Them” ,1
pu2651,PolyU,2013,2013-11-26,PolyU and CUHK Jointly Introduce telestroke for 24-hour Thrombolysis Service at Prince of Wales Hospital,1
hu0910,HKU,2012,2012-03-04,Professor Tony Fung elected Fellow of the American Association for the Advancement of Science,1
hu0924,HKU,2015,2015-04-13,HKU homepage www.hku.hk awarded Most Favourite Website in Web Accessibility Recognition Scheme 2015,1
hu0284,HKU,2013,2013-06-17,Emerson String Quartet at HKU ,1
pu2464,PolyU,2013,2013-01-23,Scientists develop special cotton that collects water from fog,1
pu1713,PolyU,2006,2006-03-23,PolyU joins force with NASA to monitor air pollution at Pearl River Delta,1
cu1409,CUHK,2012,2012-10-14,Wu Jieh Yee Charitable Foundation Donates HK$8 Million to CUHK In Support of the Development of Shiu-Ying Hu Herbarium ,1
cu1645,CUHK,2013,2013-10-07,CUHK 50th Anniversary Fair Public Lecture  Prof. Helene Fung Speaks on Ways to Enjoy Fruitful Old Age,1
cu1317,CUHK,2012,2012-05-19,"CUHK Business School Joins Hands with Education Bureau to Organize ""When Adam Smith Meets Steve Jobs: Economics × Creativity"" 66 teams of creative minds to Interpret Economic Theories with Localized Versions of “You Are the Apple of My Eye” and Time-travel Drama",1
pu1385,PolyU,2006,2006-04-04,Residents have mixed opinions towards Hong Kong Disneyland,1
cu1571,CUHK,2013,2013-06-04,CUHK to Host an Academic Conference on Life Education This Saturday Now Open to Teachers and Education Practitioners,1
hu0058,HKU,2013,2013-08-20,Centre of Buddhist Studies of The University of Hong Kong 10th Anniversary International Conference Buddhist Meditative Praxis: Traditional Teachings &amp; Modern Application ,1
cu2169,CUHK,2016,2016-01-19,CUHK ISEIS Celebrates its Tenth Anniversary,1
pu2602,PolyU,2013,2013-09-10,PolyU experts and OSHC research on cooling vests to protect workers from heat strokes ,1
cu1768,CUHK,2014,2014-03-12,CUHK Joins Hands with Local Community in Carnival this Saturday to Strengthen Neighbourhood Bonding All are welcome,1
hu0907,HKU,2012,2012-06-14,Tony Blair discusses the impact of faith and globalisation on Hong Kong and the wider world,1
