idno,univ,year,date,title,count
hu0332,HKU,2012,2012-02-21,HKU research team develops Novel Sustainable Lighting Technology – Ultra-low-loss Magnetic Ballasts,1
hu0634,HKU,2012,2012-02-26,HKU Finds Overweight and Obesity Significantly Increase the Risk of Spinal Disc Degeneration in Adults,1
cu0665,CUHK,2008,2008-03-10,2008 Hang Lung Mathematics Awards Nuture Young Talents in Developing Their Potential,1
cu1500,CUHK,2013,2013-03-05,Two CUHK Engineering Professors Elected IEEE Fellows 2013,1
pu1767,PolyU,2005,2005-04-19,Award pays tribute to PolyU expert in tourism and hospitality,1
cu0103,CUHK,2009,2009-12-08,Live Broadcast of the Nobel Lecture in Physics at CUHK,1
hu0381,HKU,2006,2006-03-24,HKU Finishes Second and Wins the Best Mooter and Best Memorial Prizes in the 4th Red Cross International Humanitarian Law Moot (IHL) Competition,1
hu0839,HKU,2010,2010-02-28,"HKU sees a record 2,300-strong team in the Standard Chartered Hong Kong Marathon",1
cu2252,CUHK,2016,2016-05-01,CUHK Wu Yee Sun College Organized Hong Kong – Tainan Cultural &amp; Creativity Exchange Programme,1
cu0270,CUHK,2009,2009-03-24,CUHK Biologist Named Croucher Senior Research Fellow 2009-2010,1
cu0155,CUHK,2009,2009-10-07,CUHK Team Took Two Weeks to Build Durable Eco School in Sichuan,1
hu0511,HKU,2012,2012-02-07,Training enables security officers to better handle patients with psychosis,1
cu2099,CUHK,2015,2015-10-16,CUHK Releases Hong Kong Quality of Life Index 2014 Quality of Life Declines Slightly,1
hu1196,HKU,2005,2005-11-10,New Technology developed by HKU to Prevent Devastating Landslide,1
cu1853,CUHK,2014,2014-07-30,CUHK’s Response to the Report Released by HA on Professor Yu Cheuk-man,1
pu1444,PolyU,2010,2010-01-22,PolyU study sheds light on lifestyle of middle-class families on mainland,1
cu1830,CUHK,2014,2014-06-10,CUHK Research Shows 60% Diabetic Patients Have Poor Sleep Auriculotherapy Helps Improve Sleep Quality and Glycaemic Control,1
cu3078,CUHK,2005,2005-06-03,Six Top Economists at Sun Hung Kai Properties Nobel Laureates Distinguished Lectures,1
pu0625,PolyU,2005,2005-12-16,PolyU hosts symposium on outcome-based approach in higher education,1
pu0858,PolyU,2007,2007-06-07,PolyU dedicates classroom to Mr Yau Chun-ying,1
hu0092,HKU,2009,2009-01-16,Opening Ceremony of the Stephen Hui Geological Museum and Launch Ceremony of HKU Faculty of Science 70th Anniversary Celebration,1
cu3591,CUHK,2006,2006-05-03,SHKP and CUHK Present Public Lectures by Five Nobel Laureates,1
hu0151,HKU,2005,2005-03-09,HKU'sFaculty of Education to Organise a Policy Forum (Press Invitation),1
cu3017,CUHK,2005,2005-06-07,A screening and surveillance study on hepatitis B virus carriers for early detection of liver cancer,1
pu0333,PolyU,2004,2004-04-26,PolyU wins five invention awards in Geneva,1
pu2298,PolyU,2012,2012-05-11,PolyU pays tribute to Outstanding Third Age Learners,1
pu2565,PolyU,2013,2013-07-12,"PolyU sets up ""Dr. Tang Kui Ming Scholarship"" with $1.5M donation",1
hu0593,HKU,2006,2006-10-26,2006 HKU Concert Series,1
cu0330,CUHK,2008,2008-12-11,SHKP and CUHK Present Nobel Economist Lecturing on New Approach to Understanding the Dynamics of Societal Change,1
hu0843,HKU,2014,2014-11-20,"21st HKICC Hospice &amp; Palliative Social Work Satellite Symposium –  “The Art of Palliative Social Work – Research, Practice and Beyond” ",1
hu1427,HKU,2011,2011-10-12,HKU Announces 2011 Q4 HK Macroeconomic Forecast,1
hu1052,HKU,2013,2013-11-18,Joint statement by HKU and Queen Mary Hospital on an article about the HKU-QMH Centre of Assisted Reproduction and Embryology,1
cu3622,CUHK,2005,2005-05-04,Chinese University and Microsoft Research Asia Establish Joint Laboratory,1
cu1836,CUHK,2014,2014-06-30,Survey Findings on the HKSAR Government’s Popularity in June 2014 Released by Hong Kong Institute of Asia-Pacific Studies at CUHK,1
pu0908,PolyU,2007,2007-10-26,PolyU students excel in International Competition,1
pu0967,PolyU,2008,2008-03-20,HKCC sponsored by SCOLAR to train student tourism ambassadors in serving Putonghua-speaking travelers,1
pu2352,PolyU,2012,2012-09-18,Mr Patrick Poon gives ardent support to PolyU ,1
cu1986,CUHK,2015,2015-03-10,I  CARE Floral Festival 2015,1
pu0611,PolyU,2005,2005-11-15,PolyU sets up Student Competitiveness Development Committee,1
pu2576,PolyU,2013,2013-07-23,PolyU design students win 2nd prize in national competition with “smart pill box for elderly”,1
cu3031,CUHK,2003,2003-04-30,Survey Reveals Encouraging Results of the Employment Situations of 2002 CUHK Graduates,1
hu1292,HKU,2012,2012-10-15,The Centre for Comparative and Public Law launches the Human Rights Portal  http://www.law.hku.hk/hrportal ,1
pu1252,PolyU,2009,2009-12-03,PolyU presents Bauhinia Cup Outstanding Entrepreneur Awards,1
pu1603,PolyU,2009,2009-04-02,PolyU spearheads research in nanostructured materials,1
cu2193,CUHK,2016,2016-02-26,CUHK Exhibits Calligraphy by Prof. Sheung Chung-ho,1
pu0354,PolyU,2004,2004-01-18,Tourism report released to address risk management in Asia Pacific,1
hu1260,HKU,2016,2016-03-30,The University of Hong Kong appoints Professor Keith Richburg as new Director of the JMSC,1
hu0773,HKU,2011,2011-04-12,The Fifth Inauguration of Endowed Professorships at HKU,1
cu1388,CUHK,2012,2012-09-17,Bowel Cancer Will Become Top Cancer in Hong Kong CUHK Introduces Colon Pill Camera to Prevent Bowel Cancer ,1
cu1886,CUHK,2014,2014-09-26,Survey Findings on the HKSAR Government’s Popularity in September 2014 Released by Hong Kong Institute of Asia-Pacific Studies at CUHK,1
cu1534,CUHK,2013,2013-04-15,CUHK Held Naming Ceremony of the Lui Che Woo Clinical Sciences Building Today ,1
hu0922,HKU,2011,2011-09-10,World Suicide Prevention Day 2011 : Symposium and Global Launch Press Conference - First Time in Asia,1
pu2019,PolyU,2010,2010-12-15,PolyU wins four awards in IENA Exhibition of Germany,1
pu0375,PolyU,2003,2003-11-17,PolyU strengthens its institutional alliance on continuing education,1
cu3532,CUHK,2003,2003-07-08,Round-the-CU Walkathon for Distressed Families Affected by SARS,1
pu1902,PolyU,2010,2010-06-09,PolyU students stage graduation fashion show,1
hu0518,HKU,2014,2014-01-19,HKU Young Brain Scientist Program to hold  Second public lecture for secondary school students “The Asymmetries in Our Mind”  ,1
pu2096,PolyU,2011,2011-05-16,PolyU reaps the harvest of innovations in Geneva's Invention Expo,1
pu0770,PolyU,2007,2007-01-30,Over 220 PolyU staff honoured for loyal service,1
pu1862,PolyU,2010,2010-03-15,PolyU alumnus gives $30m to support alma mater,1
pu0692,PolyU,2006,2006-10-11,PolyU's design school rated among top in the world,1
cu2304,CUHK,2016,2016-07-16,CUHK Institute of Future Cities recommends the best practices and strategies for low-carbon urban transport system,1
hu1419,HKU,2015,2015-06-10,UMAG to show the world’s largest collection of  “Nestorian Crosses of the Yuan Dynasty”,1
cu3529,CUHK,2004,2004-02-07,A Pioneering CUHK Scientist Elected IEEE Fellow,1
pu2681,PolyU,2013,2013-12-17,PolyU-developed space tool starts lunar exploration,1
pu0756,PolyU,2007,2007-01-04,PolyU celebrates ‘Preferred Graduate’ Development Programme’s 10th anniversary,1
pu1631,PolyU,2008,2008-08-21,PolyU Geo-Informatics scientist wins international award,1
pu1778,PolyU,2005,2005-01-11,PolyU survey finds continued community support for Hong Kong Disneyland,1
cu0638,CUHK,2008,2008-01-07,Citibank Launches New Citibank University Banking Course  with The Chinese University of Hong Kong,1
pu2279,PolyU,2012,2012-04-17,PolyU holds Tang Ping Yuan Square naming ceremony,1
cu3046,CUHK,2005,2005-03-11,Experts Investigate Important Corporate Governance Issues in China and Asia,1
cu1396,CUHK,2012,2012-09-21,CUHK Research Reveals Outreach Programme can Ease Drug-related Problems and Improve Quality of Life among Hidden Elders,1
hu1281,HKU,2005,2005-03-29,HKU releases its first Sustainability Report,1
hu1315,HKU,2016,2016-05-09,Two exhibitions to be held at the HKU Main Library refurbished atrium ,1
cu1815,CUHK,2014,2014-05-18,450th Anniversary of Shakespeare’s Birth CUHK to Hold The 10th Chinese Universities Shakespeare Festival Performance Finals,1
pu1890,PolyU,2010,2010-05-20,PolyU advances technology for optimizing digital images,1
pu6040,PolyU,2014,2014-10-09,“Festival Vernissage: Social Gastronomy” by J.C. DISI turns “less than perfect” ingredients to a “more than perfect” feast,1
pu2266,PolyU,2012,2012-03-14,Kunqu Lecture by Professor Pai Hsien-yung,1
hu1390,HKU,2013,2013-12-10,Research team led by HKU Faculty of Dentistry wins major funding to surgically treat airway obstruction in children who have craniofacial deformities ,1
cu1368,CUHK,2012,2012-08-15,Antiviral Therapy Can Prevent Liver Cancer Recurrence  CUHK Represents HK to Draw Up Asian Pacific Treatment Guideline for Chronic Hepatitis B ,1
hu1002,HKU,2013,2013-01-20,"""TKT Land Production"" Exhibition HKU Landscape Architecture exhibits to tell the stories of  Tsuen Wan and Kwai Tsing from “City｜Villages｜Countryside”",1
cu2302,CUHK,2016,2016-07-13,Survey Findings on Evaluations of Political Parties in Hong Kong  Released by Hong Kong Institute of Asia-Pacific Studies at CUHK,1
cu0249,CUHK,2009,2009-04-20,CUHK Global Business Students Win HSBC Young Entrepreneur Award,1
cu3255,CUHK,2006,2006-03-08,CUHK Business Undergraduates Won the BA Paper Competition,1
cu0440,CUHK,2008,2008-06-29,Two CUHK Graduates Receive First-ever Oxford-Croucher Scholarship to Study in the UK,1
hu0131,HKU,2011,2011-09-17,University Review Panel Begins Work in Three Stages,1
cu1151,CUHK,2011,2011-10-16,Homecoming for CUHK Life Sciences Students Pursuing Their Summer DREAM ,1
pu2450,PolyU,2013,2013-01-30,PolyU confers University Fellowship on six distinguished personalities,1
pu1520,PolyU,2005,2005-12-12,World-class Experts attend Symposium on Molecular Technology,1
pu0361,PolyU,2003,2003-12-24,PolyU-made space tool to make history,1
hu0330,HKU,2009,2009-03-24,World Bank Coordinator: Keep investing tertiary education to prepare for post-crisis growth,1
cu1947,CUHK,2014,2014-12-17,CUHK CGH Distinguished Lecture Series:  Vision and Experience Sharing from Public Health England,1
cu1775,CUHK,2014,2014-03-19,CUHK School of Architecture to Hold Exhibition and Roundtable on 'Macau: Cross-Border Cities' All are Welcome,1
cu1095,CUHK,2011,2011-08-04,World's First Search for the Origins of Barkcloth Culture from an Archaeological Perspective CUHK Hosts 'Origins of Clothes - Barkcloth' Exhibition ,1
pu1677,PolyU,2006,2006-12-15,PolyU shared the honour of its programme winning international re-accreditation with tourism experts at China Tourism Forum,1
pu2295,PolyU,2012,2012-05-03,"International Conference on ""Youth Development in the Global Context: Emergent Issues and Responses""",1
hu1213,HKU,2005,2005-03-15,2005 HKU Concert Series: The Joe Rosenberg Quartet East,1
pu6174,PolyU,2015,2015-12-10,PolyU Participates in Development of Microsatellite Platform and Deployment System,1
pu0925,PolyU,2007,2007-11-19,Breakthrough for improving construction safety at height,1
cu3176,CUHK,2004,2004-10-14,Minimally Invasive Surgery for Inguinal Hernia in Children,1
cu1049,CUHK,2011,2011-06-15,CUHK Appoints Prof. Hau Kit-tai as Pro-Vice-Chancellor and Prof. Dennis Ng as Associate Pro-Vice-Chancellor,1
pu1496,PolyU,2005,2005-06-27,PolyU's Department of Applied Social Sciences presents its first Outstanding Alumni Award,1
cu1501,CUHK,2013,2013-03-07,CUHK and Shun Hing Group Present the Lecture Series in Arts and Humanities Renowned Confucian Scholar Prof. Tu Weiming Speaks on the Sense of Cultural Identity in the Global Chinese Community ,1
hu1386,HKU,2011,2011-10-29,HKU announces an increase in both JUPAS and non-JUPAS places in 2012,1
hu1359,HKU,2011,2011-05-05,HKU FBE Students Win Global Championship in APEX Global Business IT Case Challenge,1
pu1384,PolyU,2006,2006-04-03,PolyU “head-hunters” to study head sizes of ethnic Chinese,1
pu2144,PolyU,2011,2011-07-11,PolyU's Optical Sensor Technology put to good use in High-Speed Rail,1
pu1386,PolyU,2006,2006-04-08,PolyU-affiliated HKCC provides strong support for English Festival 2006,1
hu1088,HKU,2005,2005-06-17,HKU Architecture Department Exhibition Showcases Students,1
hu1388,HKU,2016,2016-05-06,HKU responds to the media regarding a complaint case,1
hu1101,HKU,2005,2005-10-27,HKU's Faculty of Education Presented a Critical Review on Private Tutoring in Hong Kong,1
pu0322,PolyU,2004,2004-06-07,PolyU invites applications to its taught postgraduate programmes,1
hu0074,HKU,2015,2015-11-29,HKU Organises International Symposium on Mental Health and Addresses Issues in Youth Mental Health,1
hu0919,HKU,2011,2011-12-02,Centenary Distinguished Lecture by Professor Elizabeth H. Blackburn and Professor Susan Desmond-Hellmann: “The Future of Medicine: Connecting Patients to Promising Research”,1
pu1769,PolyU,2005,2005-03-30,PolyU BRE Index reflects a judicious blend of optimism and caution in housing market,1
hu0999,HKU,2008,2008-07-02,Two HKU Professors receive Outstanding Women Professionals Awards,1
pu2161,PolyU,2011,2011-10-04,PolyU is the first university to spearhead multilingualism study with 12 overseas universities – supported by EM Mobility Grant of €2.6 million,1
hu0698,HKU,2004,2004-02-16,HKU Scoops Gold Environmental Award,1
pu2472,PolyU,2013,2013-03-01,CIHK sets up Research Center for Chinese History and Culture and Research Center for Chinese Language Teaching,1
cu1017,CUHK,2011,2011-05-04,The Seventh Chinese Universities Shakespeare Festival Performance Finals Free Tickets Available to Public ,1
pu0317,PolyU,2004,2004-06-28,PolyU SPEED invites applications for professional education programmes,1
cu0393,CUHK,2008,2008-10-09,"CUHK Students Complete Global Internship Programme Participating Countries Spanning over USA, Canada, Europe, Australia and the Mainland",1
cu1040,CUHK,2011,2011-06-02,CUHK Green Pioneer Series CUHK Makes Strides in Renewable Energy Development with High-Efficiency Thin Film Solar Cell  ,1
cu0519,CUHK,2007,2007-08-21,New Efforts to Promote Internationalization Indian Professor and Interns joined CUHK Engineering,1
pu2454,PolyU,2011,2011-11-25,PolyU honours outstanding staff members,1
hu1165,HKU,2013,2013-06-10,HKU announces the first 10-year outcome study on effectiveness of early intervention on patients with psychosis Early intervention can reduce suicide rate by 60%,1
pu0934,PolyU,2007,2007-12-05,PolyU hosts International Workshop on Collaborative Human Futures,1
pu2665,PolyU,2013,2013-12-17,PolyU-developed space tool starts lunar exploration,1
hu0141,HKU,2015,2015-10-25,HKU Urban Studies students win second place in Yale-NUS Global China Connection’s ASEAN-China Case Competition 2015,1
pu2174,PolyU,2011,2011-10-29,PolyU President salutes achievements of graduates,1
pu0596,PolyU,2005,2005-11-08,PolyU achieves breakthrough in glaucoma detection,1
cu2112,CUHK,2015,2015-10-28,CUHK Undergraduate Students Explore the Arctic Potential Unleased in Extreme Conditions,1
hu0363,HKU,2015,2015-04-15,A new treatment method for stroke survivors with swallowing disorders ,1
pu0911,PolyU,2007,2007-10-31,PolyU to honour five distinguished personalities at 13th Congregation,1
cu3161,CUHK,2003,2003-04-17,"Anticipate Change and Reinvent Yourselves is Key to Survival, Li and Fung CEO Advised at CUHK EMBA ""Talking to CEOs"" Show",1
hu0105,HKU,2016,2016-04-06,HKU releases 2016 Second Quarter Hong Kong Macroeconomic Forecast,1
hu0936,HKU,2011,2011-02-24,HKU Response to the Increase in Tobacco Duty Presented in the Budget,1
hu0139,HKU,2006,2006-11-07,Vice-Chancellor Professor Lap-Chee Tsui reappointed by HKU Council,1
pu1515,PolyU,2005,2005-03-17,PolyU hosts Careers Exhibition,1
hu1328,HKU,2004,2004-10-04,"Hong Kong Macroeconomic Forecast to be released on October 6, 2004(Press Invitation)",1
pu2668,PolyU,2013,2013-12-31,PolyU to advance textiles technology through the ninth endowed professorship,1
cu1861,CUHK,2014,2014-08-14,"CUHK Appoints Deans of Graduate School, Business Administration, and Social Science",1
cu1285,CUHK,2012,2012-04-02,CUHK-PWH Lee Quo Wei Cardiovascular Intervention Centre Officially Opens Equipped with Cutting Edge Technology to Serve the Territory ,1
cu1745,CUHK,2014,2014-01-28,Survey Findings on the HKSAR Government’s Popularity in January 2014 Released by Hong Kong Institute of Asia-Pacific Studies at CUHK,1
cu1876,CUHK,2014,2014-09-11,700 CUHK Students Demonstrate ‘ICARE’ Spirit Number of Students Participating in Social Service Programme Doubled,1
cu2196,CUHK,2016,2016-03-01,Talks on “Jingkun Opera” from Two National Actors Held by CUHK Lee Woo Sing College,1
cu2285,CUHK,2016,2016-06-14,CUHK ISEIS Holds International Workshop on South China Sea Coastal and Ocean Meso-scale Processes,1
pu1708,PolyU,2006,2006-04-12,PolyU academic awarded Doctor of Science by the University of Cambridge,1
pu1986,PolyU,2010,2010-10-29,PolyU takes the lead in studying children's sensory problems,1
pu1763,PolyU,2005,2005-05-12,Top international award for PolyU's energy-efficient designs,1
cu0984,CUHK,2011,2011-03-03,CUHK Faculty of Engineering Launches New Focus Areas to Celebrate 20th Anniversary ,1
cu0680,CUHK,2007,2007-01-09,World Authority in Contemporary China Studies Ezra Vogel Lectured on Sino-Japanese Relations,1
cu3221,CUHK,2003,2003-11-25,Seven Distinguished Persons Honoured by CUHK,1
pu0892,PolyU,2007,2007-09-17,"PolyU ""head-hunters"" share results of SizeChina.com",1
hu0768,HKU,2007,2007-12-05,HKU to name Twelve Outstanding Individuals as Fellows,1
cu1175,CUHK,2011,2011-11-11,Henry G Leong Gerontology and Geriatrics Endowed Professorship Lecture by Professor Jean Woo ,1
hu0845,HKU,2014,2014-05-11,HKU Japanese Society holds mini Model UN discussion on the future of nuclear energy in East Asia,1
cu1214,CUHK,2011,2011-12-15,The Chinese University of Hong Kong Holds its 70th Congregation for the Conferment of Degrees,1
hu0802,HKU,2014,2014-10-19,HKU’s architecture project “The Pinch” wins prestigious World Small Project of the Year 2014,1
hu0419,HKU,2007,2007-06-21,University-Industry Partnership for boosting the Construction Industry -- Technology Transfer with a “SMILE”,1
cu0441,CUHK,2008,2008-06-27,CUHK Appoints Prof. Xu Yangsheng as Associate Pro-Vice-Chancellor and Mr. Eric Ng as Registrar ,1
pu1281,PolyU,2005,2005-06-16,PolyU's fashion and textiles students stage graduation fashion show,1
cu1805,CUHK,2014,2014-04-28,Survey Findings on HKSAR Government’s Popularity in April 2014 Released by Hong Kong Institute of Asia-Pacific Studies at CUHK,1
hu0905,HKU,2010,2010-11-17,A World-Class International Journalism Degree – In the Heart of Asia,1
pu0374,PolyU,2003,2003-11-23,Double happiness for PolyU,1
cu3394,CUHK,2003,2003-10-13,Appointment of the Vice-Chancellor of CUHK,1
hu1263,HKU,2004,2004-04-23,Academics to Provide Their Views on Hong Kong,1
pu1105,PolyU,2009,2009-02-04,PolyU Appoints World-Class Scholar in Risk and Decision Analysis,1
pu2299,PolyU,2012,2012-05-21,PolyU's Business School Forms Strategic Partnership with Korn/Ferry for Leadership Development of MBA Students,1
pu0336,PolyU,2004,2004-03-30,PolyU hosts first Hall Festival to share joy of hostel life,1
hu0084,HKU,2008,2008-05-23,HKU Reaches the Ceiling of Stanley Ho Alumni Challenge Matching on its 2nd Year,1
pu0352,PolyU,2004,2004-01-30,PolyU honours Jackie Chan and hosts Asian premiere of ‘Dragon?movie,1
pu0392,PolyU,2003,2003-09-28,PolyU launches new drive to boost donation,1
cu0056,CUHK,2010,2010-02-10,CUHK Prof. Christopher H.K. Cheng Awarded State Natural Science Award for Composition Analysis of Medicinally Important Plants,1
cu2273,CUHK,2016,2016-05-29,CUHK Into Gravitational Wave Detection: Becomes First Hong Kong Member of LIGO,1
pu0985,PolyU,2008,2008-05-07,HKCC Putonghua Training Programme for Student Tourism Ambassadors,1
hu0997,HKU,2006,2006-03-14,HKU Awards Six Honorary Degrees,1
pu1530,PolyU,2006,2006-05-18,PolyU's School of Accounting and Finance launches “FastTrack to the Real World” programme,1
cu2303,CUHK,2016,2016-07-14,CUHK Chung Chi College Organises Lee Shiu Summer Programme 2016,1
pu2491,PolyU,2013,2013-04-08,PolyU hosts Symposium on Citizenship Education,1
pu0639,PolyU,2006,2006-01-06,PolyU hails success of summer placements for students,1
pu0661,PolyU,2006,2006-07-17,HKCC and British Council team up to sharpen Associate Degree students&amp;#39; English language skills,1
pu1280,PolyU,2005,2005-01-07,PolyU hosts 'Preferred Graduate' Development Programme Forum 2005,1
pu1632,PolyU,2008,2008-07-28,PolyU designs sweep four awards in Malaysian Invention Exhibition,1
cu0583,CUHK,2007,2007-11-23,SHKP and CUHK Present Nobel Lecture on Molecular Structures in Post-genomic Research,1
pu0998,PolyU,2008,2008-05-29,Nobel Laureate hosts forum on Incentives in Healthcare,1
hu1127,HKU,2011,2011-06-25,HKU and HSBC announce Hong Kong’s First Comprehensive Research-cum-Public Education Programme on Climate Change and Local Forests,1
pu6227,PolyU,2016,2016-06-15,PolyU fashion design graduates stage Fashion Show 2016,1
cu3124,CUHK,2003,2003-05-22,United College Dr Tse Yuen Man Memorial Scholarship,1
hu1201,HKU,2015,2015-10-25,HKU School of Public Health hosts the Fifth Hong Kong Public Health Forum on“Extracting Meaning from Data: Cohorts and Deep Analytics” and pays tribute to Professor TH Lam,1
cu3293,CUHK,2006,2006-05-01,CUHK Economics No. 1 in East Asia,1
hu0980,HKU,2014,2014-07-13,307 outstanding Mainland students admitted to HKU’s 2014/15 undergraduate programme,1
cu1608,CUHK,2013,2013-08-16,"OBITUARY Dr the Honourable Lee Quo Wei, GBM, JP",1
pu0852,PolyU,2007,2007-05-29,PolyU’s 70th Anniversary Innovation &amp; Technology Showcase,1
hu1366,HKU,2014,2014-09-18,Up to one million times faster than existing technology  HKU advances new optical spectroscopy technology PASTA for breakthroughs in clinical and pathological diagnosis and smart green engine development ,1
hu0831,HKU,2016,2016-05-04,HKU Reveals that Exposure to Particulate Air Pollutants is Associated with Cancer Mortality in a 13-year Local Study of Hong Kong Elderly,1
pu2597,PolyU,2013,2013-09-03,PolyU School of Design launches 2013 Annual Show at new building designed by Zaha Hadid,1
cu3209,CUHK,2004,2004-09-27,Four Distinguished Persons Honoured by CUHK,1
hu1058,HKU,2005,2005-01-07,HKU and London Business School to enter into collaboration (Press Invitation),1
pu2692,PolyU,2014,2014-02-19,PolyU hosts stress management workshops for a balanced life,1
cu1297,CUHK,2012,2012-04-17,CUHK Urges Widespread Helmet Use and Protective Measures Against Cycling-related Traumatic Brain Injury ,1
hu0506,HKU,2009,2009-03-24,Three Distinguished HKU Scholars receive Croucher Awards,1
pu2325,PolyU,2012,2012-05-28,PolyU wins overseas recognition for launching service-learning projects in Sham Shui Po,1
hu0235,HKU,2014,2014-04-14,HKU wins five Gold Awards in  government Web Accessibility Recognition Scheme,1
cu1669,CUHK,2013,2013-10-27,CUHK Releases Research Results on Employment Status of Hong Kong Chronic Kidney Disease (CKD) Dialysis Patients and Promotes Predialysis Education Programme for Mid to Late Stage CKD patients,1
cu1905,CUHK,2014,2014-10-18,CUHK Orientation Day for Undergraduate Admissions Draws Fifty-five Thousand Visitors,1
pu1136,PolyU,2009,2009-03-24,PolyU plays host to distinguished seminar on The Intelligent Airport project,1
pu0391,PolyU,2005,2005-11-21,PolyU develops rehab technology for Chinese Olympic athletes,1
pu2544,PolyU,2013,2013-06-13,"PolyU hosts International Forum on Shipping, Ports and Airports",1
cu0344,CUHK,2008,2008-11-25,CUHK Accomplishes the First Totally Implantable Hearing Aid in Asia,1
cu1847,CUHK,2014,2014-07-22,CUHK Professor Finds Salt Tolerance Gene from Wild Soybeans A Possible Way to Alleviate Salinization Problem of Farm Lands,1
pu2042,PolyU,2011,2011-01-31,"""DesignPlus Fashion Competition 2011"" comes to fruitful close",1
hu1043,HKU,2008,2008-02-15,"HKU Scholars Propose on Ensuring Compliance with ""Planning Conditions"" in Property Development",1
hu1207,HKU,2016,2016-03-17,When classic meets modern  The Art of Takashi Wakamiya: Contemporary Japanese Lacquer Showcasing the meticulous process of craftsmanship  ,1
cu0949,CUHK,2011,2011-01-12,Celebrated Author and Educator Prof. Harry R. Lewis to Speak at CUHK Public Lectures Open for Registration,1
hu0510,HKU,2005,2005-11-22,HKU's Experts Call For Voice Protection Education,1
hu0485,HKU,2005,2005-04-06,"Hong Kong Macroeconomic Forecast to be released on April 7, 2005 (Press Invitation)",1
cu0040,CUHK,2010,2010-03-15,CUHK Developed a Simple Score to Predict Future Risk of Liver Cancer in Patients with Chronic Hepatitis B,1
pu0300,PolyU,2004,2004-09-01,PolyU takes a big leap forward in recruiting non-local students,1
cu0752,CUHK,2007,2007-06-06,CUHK embarks on the next information revolution  – Network Coding Theory,1
pu1556,PolyU,2006,2006-07-24,Logistics student awarded industry scholarship,1
cu0152,CUHK,2009,2009-10-08,CUHK Discovers Type D Personality is Highly Associated with Coronary Heart Disease,1
hu1102,HKU,2005,2005-05-04,HKU China IT &amp; Law Centre to Launch Website on Legal Information (Press Invitation),1
hu0806,HKU,2004,2004-02-04,HKU's Chair of Comparative Education to Deliver Inaugural Professorial Lecture,1
pu2627,PolyU,2013,2013-10-27,"PolyU salutes 11,106 graduates at 19th Congregation",1
pu1617,PolyU,2007,2007-05-02,PolyU wins top honours in Geneva’s Invention Expo,1
cu0075,CUHK,2010,2010-01-19,CUHK Holds International Workshop on Spatial Information Technologies for Monitoring the Deformation of Large-Scale Man-made Linear Features,1
